"udlejning_kode";"udlejning";"aktiv";"begrebsdefinition"
1;"Udlejet";1;"Kommunen har udlejet arealet til privat person/virksomhed"
2;"Vederlagsfrit";1;"udlejnings vilkår: arealet stilles vederlagsfrit til rådighed eller lejes af andre til brug for kommunen"
3;"Lejet";1;"Kommunen er lejer af arealet"
4;"Forpagtet";1;"Forpagtning er en aftale mellem to parter, der indebærer, at en person får rådighed over og pligt til at drive den virksomhed, der ejes af den, der bortforpagter."
8;"Andet";1;"Ingen af de andre passer entydigt på objektet."
9;"Uoplyst";1;"Mangler viden for at kunne udfylde feltet."
