"svaerhed_k";"svaerhed";"aktiv";"begrebsdefinition"
1;"Meget let";1;"MTB: MTB-rytter nybegynder/uden grundlæggende færdigheder"
2;"Let";1;"Vandreruter: Asfalt, stenmel eller andet fast underlag. Fortrinsvis flad rute, moderate stigninger ingen stejle op og nedgange. Cykelruter: Landeveje og cykelstier, asfalt underlag, ingen eller få/korte svære passager, egnet til ryttercykel. MTB: MTB-rytter med grundlæggende færdigheder"
3;"Middel/Moderat";1;"Vandreruter: Blandet underlag f.eks. asfalt, stenmel eller andet fast underlag, men også mere udfordrende og blødt underlag i form af f.eks. skovstier og spor. Mere udfordrende stigninger og nedgange kan forekomme (varieret terræn!), med broovergange, klaplåger, trapper og lignende. Cykelruter: Blanding af asfalt og grusveje, kan indeholde sværere passager, egnet til turcykling. MTB: Den øvede MTB-rytter"
4;"Svær/udfordrende";1;"Vandreruter: Trampestier i åbent og lukket terræn - skove, kyster mv. Udfordrende stigninger og nedgange kan forekomme (stejlt terræn), med stenter, gangbrædder, trin og lignende. Mange typer af udfordringer kan forekomme. Cykelruter: Forvent skovveje og mindre vedligeholdte spor, bedst egnet til kraftigere turcykler med brede dæk. MTB: Ekspert MTB-rytter"
5;"Ekstrem";1;"MTB: Specialiserede discipliner og ofte højrisiko MTB-kørsel"
8;"Andet";1;"Andet"
9;"Ukendt";1;"Mangler viden om sværhedsgraden"